{
  "id": "zettelkasten-method",
  "createdAt": "2024-01-01T00:00:00.000Z",
  "title": "The Zettelkasten Method",
  "type": "research",
  "status": "published",
  "source": "https://zettelkasten.de/introduction/",
  "tagIds": [
    "research",
    "productivity"
  ],
  "linkedNoteIds": [
    "welcome-to-your-knowledge-base"
  ],
  "rating": 9,
  "content": "## Overview\n\nZettelkasten (German for \"slip box\") is a knowledge management method developed by sociologist Niklas Luhmann. He used it to produce over 70 books and 400 articles over his lifetime.\n\n## Core Principles\n\n### Atomic Notes\nEach note captures one idea only — no sprawling summaries. Atomic notes are easier to link and reuse.\n\n### Unique IDs\nEvery note gets a permanent, unique identifier. This decouples the note's location from its content and makes links stable.\n\n### Links Over Hierarchy\nInstead of filing notes into folders (which forces premature categorization), notes are linked to related ideas. A network of notes emerges organically.\n\n### The Principle of Atomicity\n- Write in your own words — forces genuine understanding\n- One idea per note — keep it short and focused\n- Link liberally — connections are the value\n\n## Why It Works\n\nLuhmann described his Zettelkasten as a \"conversation partner\" — when returning to old notes, unexpected connections surface. The system generates insights that no single note contains.\n\n## Relevance to Brain Vault\n\nBrain Vault's architecture is a natural digital Zettelkasten:\n- File-per-note = permanent, addressable records\n- `linkedNoteIds` = wikilink-style connections\n- Tags provide lightweight categorization without locking notes into folders\n- Real-time dashboard = instant visibility into the knowledge graph\n",
  "summary": "Zettelkasten is a note-taking method based on atomic, linked notes. Brain Vault's file-per-note + linkedNoteIds model implements the same principles digitally."
}
