{
  "id": "2025-11-14-friday",
  "createdAt": "2024-01-01T00:00:00.000Z",
  "title": "2025-11-14 — Friday",
  "type": "daily",
  "status": "published",
  "date": "2025-11-14",
  "tagIds": [
    "productivity",
    "personal"
  ],
  "linkedNoteIds": [
    "welcome-to-your-knowledge-base"
  ],
  "rating": 7,
  "content": "## Priorities\n- [ ] Set up knowledge base template\n- [ ] Review and tag existing notes\n- [ ] Plan weekend reading list\n\n## Log\n- 09:00 — Morning coffee, reviewed goals for the week\n- 10:30 — Started building the knowledge base\n- 14:00 — Deep work session on template design\n- 16:00 — Wrapped up, linked notes together\n\n## Reflections\nProductive day. The single-entity approach for the knowledge base feels right — keeps things simple while being flexible enough for any note type. Looking forward to seeing the graph of linked notes grow.\n",
  "summary": "Set up knowledge base, deep work on template design. Good day."
}
